{"schemaVersion":1,"approvalId":"mapping-fixture","requestId":"fixture-request","revisionId":"fixture-map","proposalHash":"16935711c205495782334aa035d6221c3ad26d333521f9b974e2b0235d7a223b","sourceBundleHash":"b112381b345152b31db80d179b651477a0466e9a13eeeb79ac98d498914f93d1","briefHash":"9d00b8844c7089f2eea06dece3ea736964e4d6472a54a79926b68594f9dff8a2","provenanceHash":"f33a5177f1556074a347fe578b3a8bbcb3329fcad6f7524c8a3e536046c63b40","regionDecisions":[{}],"acceptedLayerIds":["water"],"canonicalBindings":[],"rejectedRegionIds":[],"acknowledgedCoreProposalIds":[],"budgets":{},"visualScorecard":{},"approvedBy":"human","approvedAt":"2026-09-28T00:00:00Z"}
